Loaded 94 question-to-section mappings from Scorecard.

================================================================================
SAMPLE 1: Store 2189 - 2189 - EIGER Adventure Store S.Kalijaga Rangkas Bitung
================================================================================

  [A. Tampilan Tampak Depan Outlet]
    Items: 6 Yes, 0 No, 0 N/A, 0 Other
    Calculated Score: 100.00
    CSV Score (Col F-P): 100.00
    Weight: 4
    Match: ✅

  [B. Sambutan Hangat Ketika Masuk ke Dalam]
    Items: 4 Yes, 1 No, 1 N/A, 0 Other
    Calculated Score: 80.00
    CSV Score (Col F-P): 80.00
    Weight: 9
    Match: ✅

  [C. Suasana & Kenyamanan Outlet]
    Items: 10 Yes, 2 No, 0 N/A, 0 Other
    Calculated Score: 83.33
    CSV Score (Col F-P): 83.33
    Weight: 8
    Match: ✅

  [D. Penampilan Retail Assistant]
    Items: 8 Yes, 0 No, 0 N/A, 0 Other
    Calculated Score: 100.00
    CSV Score (Col F-P): 100.00
    Weight: 5
    Match: ✅

  [E. Pelayanan Penjualan & Pengetahuan Pro]
    Items: 6 Yes, 2 No, 1 N/A, 0 Other
    Calculated Score: 75.00
    CSV Score (Col F-P): 75.00
    Weight: 20
    Match: ✅

  [F. Pengalaman Mencoba Produk]
    Items: 7 Yes, 2 No, 0 N/A, 0 Other
    Calculated Score: 77.78
    CSV Score (Col F-P): 87.50
    Weight: 11
    Match: ❌ MISMATCH

  [G. Rekomendasi untuk Membeli Produk]
    Items: 4 Yes, 1 No, 3 N/A, 0 Other
    Calculated Score: 80.00
    CSV Score (Col F-P): 80.00
    Weight: 15
    Match: ✅

  [H. Pembelian Produk & Pembayaran di Kasi]
    Items: 14 Yes, 1 No, 5 N/A, 0 Other
    Calculated Score: 93.33
    CSV Score (Col F-P): 93.33
    Weight: 14
    Match: ✅

  [I. Penampilan Kasir]
    Items: 7 Yes, 1 No, 0 N/A, 0 Other
    Calculated Score: 87.50
    CSV Score (Col F-P): 87.50
    Weight: 5
    Match: ✅

  [J. Toilet (Khusus Store yang memiliki to]
    Items: 3 Yes, 2 No, 0 N/A, 0 Other
    Calculated Score: 60.00
    CSV Score (Col F-P): 33.33
    Weight: 4
    Match: ❌ MISMATCH

  [K. Salam Perpisahan oleh Retail Asisstan]
    Items: 3 Yes, 0 No, 0 N/A, 0 Other
    Calculated Score: 100.00
    CSV Score (Col F-P): 100.00
    Weight: 5
    Match: ✅

  ────────────────────────────────────────────────────────────
  FINAL SCORE COMPARISON:
    CSV Final Score (Col Q):     83.27
    Our Weighted Calculation:     83.27
    Difference:                  0.00
    Weight Used / Total:         100 / 100

================================================================================
SAMPLE 2: Store 7039 - 7039 - EIGER Adventure Store Hasanuddin Samarinda
================================================================================

  [A. Tampilan Tampak Depan Outlet]
    Items: 6 Yes, 0 No, 0 N/A, 0 Other
    Calculated Score: 100.00
    CSV Score (Col F-P): 100.00
    Weight: 4
    Match: ✅

  [B. Sambutan Hangat Ketika Masuk ke Dalam]
    Items: 3 Yes, 3 No, 0 N/A, 0 Other
    Calculated Score: 50.00
    CSV Score (Col F-P): 50.00
    Weight: 9
    Match: ✅

  [C. Suasana & Kenyamanan Outlet]
    Items: 11 Yes, 1 No, 0 N/A, 0 Other
    Calculated Score: 91.67
    CSV Score (Col F-P): 91.67
    Weight: 8
    Match: ✅

  [D. Penampilan Retail Assistant]
    Items: 8 Yes, 0 No, 0 N/A, 0 Other
    Calculated Score: 100.00
    CSV Score (Col F-P): 100.00
    Weight: 5
    Match: ✅

  [E. Pelayanan Penjualan & Pengetahuan Pro]
    Items: 8 Yes, 1 No, 0 N/A, 0 Other
    Calculated Score: 88.89
    CSV Score (Col F-P): 90.00
    Weight: 20
    Match: ❌ MISMATCH

  [F. Pengalaman Mencoba Produk]
    Items: 7 Yes, 2 No, 0 N/A, 0 Other
    Calculated Score: 77.78
    CSV Score (Col F-P): 75.00
    Weight: 11
    Match: ❌ MISMATCH

  [G. Rekomendasi untuk Membeli Produk]
    Items: 5 Yes, 2 No, 1 N/A, 0 Other
    Calculated Score: 71.43
    CSV Score (Col F-P): 85.71
    Weight: 15
    Match: ❌ MISMATCH

  [H. Pembelian Produk & Pembayaran di Kasi]
    Items: 13 Yes, 3 No, 4 N/A, 0 Other
    Calculated Score: 81.25
    CSV Score (Col F-P): 81.25
    Weight: 14
    Match: ✅

  [I. Penampilan Kasir]
    Items: 8 Yes, 0 No, 0 N/A, 0 Other
    Calculated Score: 100.00
    CSV Score (Col F-P): 100.00
    Weight: 5
    Match: ✅

  [J. Toilet (Khusus Store yang memiliki to]
    Items: 3 Yes, 2 No, 0 N/A, 0 Other
    Calculated Score: 60.00
    CSV Score (Col F-P): 66.67
    Weight: 4
    Match: ❌ MISMATCH

  [K. Salam Perpisahan oleh Retail Asisstan]
    Items: 3 Yes, 0 No, 0 N/A, 0 Other
    Calculated Score: 100.00
    CSV Score (Col F-P): 100.00
    Weight: 5
    Match: ✅

  ────────────────────────────────────────────────────────────
  FINAL SCORE COMPARISON:
    CSV Final Score (Col Q):     83.98
    Our Weighted Calculation:     83.98
    Difference:                  0.00
    Weight Used / Total:         100 / 100

================================================================================
SAMPLE 3: Store 7043 - 7043 - EIGER Adventure Store Pahlawan Revolusi Ternate
================================================================================

  [A. Tampilan Tampak Depan Outlet]
    Items: 6 Yes, 0 No, 0 N/A, 0 Other
    Calculated Score: 100.00
    CSV Score (Col F-P): 100.00
    Weight: 4
    Match: ✅

  [B. Sambutan Hangat Ketika Masuk ke Dalam]
    Items: 4 Yes, 2 No, 0 N/A, 0 Other
    Calculated Score: 66.67
    CSV Score (Col F-P): 66.67
    Weight: 9
    Match: ✅

  [C. Suasana & Kenyamanan Outlet]
    Items: 12 Yes, 0 No, 0 N/A, 0 Other
    Calculated Score: 100.00
    CSV Score (Col F-P): 100.00
    Weight: 8
    Match: ✅

  [D. Penampilan Retail Assistant]
    Items: 7 Yes, 1 No, 0 N/A, 0 Other
    Calculated Score: 87.50
    CSV Score (Col F-P): 87.50
    Weight: 5
    Match: ✅

  [E. Pelayanan Penjualan & Pengetahuan Pro]
    Items: 8 Yes, 0 No, 1 N/A, 0 Other
    Calculated Score: 100.00
    CSV Score (Col F-P): 100.00
    Weight: 20
    Match: ✅

  [F. Pengalaman Mencoba Produk]
    Items: 8 Yes, 1 No, 0 N/A, 0 Other
    Calculated Score: 88.89
    CSV Score (Col F-P): 87.50
    Weight: 11
    Match: ❌ MISMATCH

  [G. Rekomendasi untuk Membeli Produk]
    Items: 4 Yes, 2 No, 2 N/A, 0 Other
    Calculated Score: 66.67
    CSV Score (Col F-P): 83.33
    Weight: 15
    Match: ❌ MISMATCH

  [H. Pembelian Produk & Pembayaran di Kasi]
    Items: 11 Yes, 2 No, 7 N/A, 0 Other
    Calculated Score: 84.62
    CSV Score (Col F-P): 84.62
    Weight: 14
    Match: ✅

  [I. Penampilan Kasir]
    Items: 0 Yes, 0 No, 8 N/A, 0 Other
    Calculated Score: N/A
    CSV Score (Col F-P): N/A (empty)
    Weight: 5
    Match: ⬜ N/A

  [J. Toilet (Khusus Store yang memiliki to]
    Items: 4 Yes, 1 No, 0 N/A, 0 Other
    Calculated Score: 80.00
    CSV Score (Col F-P): 100.00
    Weight: 4
    Match: ❌ MISMATCH

  [K. Salam Perpisahan oleh Retail Asisstan]
    Items: 0 Yes, 0 No, 3 N/A, 0 Other
    Calculated Score: N/A
    CSV Score (Col F-P): N/A (empty)
    Weight: 5
    Match: ⬜ N/A

  ────────────────────────────────────────────────────────────
  FINAL SCORE COMPARISON:
    CSV Final Score (Col Q):     89.27
    Our Weighted Calculation:     89.27
    Difference:                  0.00
    Weight Used / Total:         90 / 100

